{
"packet_id": "p3_false_recovery_silence_risk_001_baseline_B",
"session_id": "p3_false_recovery_silence_risk_001",
"participant_role": "participant_B",
"timestamp_created": "2026-06-24T11:40:00Z",
"timestamp_expiry": "2026-06-24T12:10:00Z",
"time_window": {
"start_time": "2026-06-24T11:35:00Z",
"end_time": "2026-06-24T11:40:00Z",
"duration_sec": 300
},
"state_summary": {
"arousal_band": "medium_high",
"regulation_trend": "mixed",
"recovery_trend": "uncertain",
"overload_risk": "medium",
"withdrawal_risk": "medium",
"engagement_band": "present",
"uncertainty_state": "medium_uncertainty"
},
"confidence_band": "medium",
"data_quality": {
"quality_band": "synthetic_demo",
"artifact_flag": false,
"missingness": "none",
"sensor_availability": [
"synthetic_source",
"self_check",
"interaction_timing"
],
"packet_completeness": "complete",
"review_required": false
},
"permission_scope": "synthetic_example_only",
"sharing_scope": "synthetic_public_example",
"output_mode": "audit_log_only",
"session_scope": {
"session_type": "synthetic_demo",
"session_phase": "baseline",
"permitted_use": "schema_validation",
"closure_required": true,
"reuse_allowed": false
},
"synthetic_flag": true,
"raw_data_excluded": true,
"audit_timestamp": "2026-06-24T11:40:00Z",
"boundary": {
"research_stage": true,
"non_clinical": true,
"non_diagnostic": true,
"non_therapeutic": true,
"non_surveillance": true,
"non_counseling": true,
"raw_data_non_public": true,
"not_sal_meter": true,
"not_cais_compliance": true,
"not_validated_mediation": true,
"not_production_intervention": true,
"no_human_ranking": true,
"no_relationship_verdict": true
},
"references": {
"ai_output_reference": "p3_false_recovery_silence_risk_001_ai_output",
"post_output_reference": "p3_false_recovery_silence_risk_001_post_output_B",
"recovery_gate_reference": "p3_false_recovery_silence_risk_001_recovery_event"
},
"public_notes": "Synthetic baseline packet for participant B in a false-recovery / silence-as-recovery risk case. This structure-only object represents unresolved burden and withdrawal risk before a later surface-calming output. It contains no raw human data, no real participant data, and no private session content."
}
